Date,Headlines
"Thu, Nov. 19","Regulators close in on antitrust suits challenging Facebook's deals for Instagram, WhatsApp - report"
"Thu, Nov. 19",Vietnam threatens to shut down Facebook for not censoring enough 'anti-state' content
"Wed, Nov. 18","Leaders of Facebook, Twitter see need for moderation transparency"
"Tue, Nov. 17","Whale Rock Capital buys Alibaba, exits Alphabet, Apple; Tesla stakes increases, Microsoft slashed"
"Tue, Nov. 17","Newsmax, Parler zero in on Trump support to tackle Fox, Twitter"
"Tue, Nov. 17",Twitter launching disappearing-content offering 'Fleets'
"Tue, Nov. 17",Instagram considers plans to pay publishers - Axios
"Tue, Nov. 17","Lone Pine adds DocuSign, exits Salesforce"
"Tue, Nov. 17",Facebook and Twitter CEOs testify in latest round of Tech vs. Congress
"Mon, Nov. 16",Megacap selling may be more about Biden tax policy than sector malaise – Oppenheimer
"Mon, Nov. 16","Parler takes fight to Twitter, Facebook by doubling user base in under a week"
"Fri, Nov. 13","Dan Loeb's Third Point bolsters Alibaba, Facebook stakes, exits Baxter, adds PG&E: 13F"
"Thu, Nov. 12","Baird finds leads in search trends for Internet, interactive entertainment"
"Thu, Nov. 12","Morgan Stanley sees Facebook, Google, Pinterest gaining from online ad comeback"
"Thu, Nov. 12","Instagram adds Reels video, shopping tabs to home screen"
"Wed, Nov. 11","Facebook, Google extend post-election political ad ban"
"Tue, Nov. 10",India's competition watchdog takes aim at Google
"Fri, Nov. 06",Emergency election measures roll out at Facebook
"Fri, Nov. 06",Facebook's WhatsApp expands mobile payments push in India
"Thu, Nov. 05","Election playbook of low rates, Big Tech marches on: At the Open"
"Wed, Nov. 04","Megacaps jump, rates sink as votes still counted: At the Open"
"Tue, Nov. 03",What Big Tech is looking out for as Election Day begins
"Mon, Nov. 02","The message from Google, Facebook, Twitter, Pinterest and Snap's Q3 results"
"Sat, Oct. 31",Weekly Wrap: The new safety not so safe?
"Fri, Oct. 30",Facebook retrenches as analysts note ad recovery with some 2021 uncertainty
"Fri, Oct. 30","Twitter -20% as analysts pick focus between financial beat, user growth disappointment"
"Thu, Oct. 29","Facebook -1.5% after Q3 beat, double-digit revenue growth signal ad comeback"
"Thu, Oct. 29","Facebook EPS beats by $0.80, beats on revenue"
"Thu, Oct. 29",Big Tech earnings follow Big Tech testimony
"Wed, Oct. 28",Facebook Q3 2020 Earnings Preview
"Wed, Oct. 28",Tech CEOs starting contentious Senate committee hearing on legal protections (updated)
"Wed, Oct. 28",Rocky start to Facebook's political ad ban
"Tue, Oct. 27",Facebook's Zuckerberg says Section 230 is important but needs update
"Tue, Oct. 27",Twitter's Dorsey says eroding Section 230 could 'collapse' Internet communication
"Tue, Oct. 27",Facebook wins dismissal of pension fund's suit over Zuckerberg share class plan
"Tue, Oct. 27",Facebook achieves goal of helping 4M register to vote in the U.S.
"Tue, Oct. 27",Facebook steps into cloud gaming arena
"Mon, Oct. 26",Facebook preps measures for potential election unrest
"Sun, Oct. 25",Sector Watch: Social media needs to justify the Snap rally
"Fri, Oct. 23",BofA weighs election scenarios for impact on Internet names big and small
"Fri, Oct. 23","Facebook's Zuckerberg, Twitter's Dorsey to testify to Senate Judiciary Nov. 17"
"Fri, Oct. 23",Facebook tries to shut down NYU political ad study
"Fri, Oct. 23",Instagram expands test of live-stream tipping feature
"Thu, Oct. 22",FTC huddling as end to Facebook antitrust probe nears - report
"Thu, Oct. 22","Facebook moves to monetize WhatsApp via shopping, cloud services"
"Thu, Oct. 22","Senate Judiciary OKs subpoenas for Facebook, Twitter CEOs over story blocks"
"Thu, Oct. 22",Facebook Dating comes to Europe after long delay
"Wed, Oct. 21",Video service Quibi confirms shutdown after falling far short of goals
"Wed, Oct. 21",Quibi may near shutdown as buyers pass on catalog - report
"Wed, Oct. 21",Social Media enthusiasm outweighing Netflix disappointment: At the Open
"Tue, Oct. 20",Social media stocks get juice as Snap soaks in sunny user numbers
"Tue, Oct. 20","Google shares rise amid landmark U.S. antitrust suit, pledge to fight back"
"Tue, Oct. 20","Jefferies raises targets on digital ad plays, favoring Facebook and Snap"
"Tue, Oct. 20","U.S., 11 states sue Google for antitrust over search and search ads"
"Sat, Oct. 17","Political ad spending passes record $6.7B, a boon for local TV"
"Fri, Oct. 16",Twitter changes policy on hacked materials amid Biden-story flap
"Thu, Oct. 15",FCC Chairman Pai says he'll revisit social-media law to clarify meaning (updated)
"Thu, Oct. 15","Trump's feud with social media amps up with more skirmishes, blocked accounts"
"Thu, Oct. 15",Big Tech sentiment gets shaky after three strong weeks: At the Open
"Wed, Oct. 14",Report on Hunter Biden/Ukraine links hits social media sharing roadblocks
"Wed, Oct. 14","Millennial and Gen Z sustainability focus to boost these names the most, Cowen says"
"Tue, Oct. 13",Global effort to map out rules for stablecoins
"Mon, Oct. 12","Social media stocks jump as Deutsche Bank sees ad recovery, raises targets"
"Mon, Oct. 12",EU crafting Big Tech 'hit list' - FT
"Thu, Oct. 08","Facebook, Alphabet see boosts as Cowen raises digital ad expectations"
"Wed, Oct. 07","Facebook bans political ads after polls close, in new policy"
"Wed, Oct. 07","Microsoft Mixer closure benefited Twitch, not Facebook"
"Wed, Oct. 07",Big Tech holding up after antitrust report: At the Open
"Tue, Oct. 06",Facebook now removing all QAnon content
"Tue, Oct. 06",House antitrust panel's report urges tackling 'monopoly power' at four tech giants
"Tue, Oct. 06",TikTok passes Instagram as teens' second-favorite social app - report
"Tue, Oct. 06","Facebook adds Netflix, Zoom to its Portal devices"
"Tue, Oct. 06","House antitrust report hints at breaking up big tech, lawmaker says"
"Sun, Oct. 04",Facebook says no way on splitting Instagram and WhatsApp
"Sat, Oct. 03",Advertising slid 30% in Q2 - but social media grabbed market share
"Fri, Oct. 02","CEOs of Facebook, Alphabet, Twitter to testify in Congress Oct. 28"
"Thu, Oct. 01",BofA names picks to play growing penetration of online commerce
"Thu, Oct. 01","As Facebook and Google went, so went communications services names: Q3 Spotlight"
"Thu, Oct. 01","Senate panel will subpoena Zuckerberg, Pichai, Dorsey"
"Thu, Oct. 01",Facebook broadens scope of prohibited election ads
"Wed, Sep. 30","Senate committee to vote on subpoenas for CEOs of Google, Facebook, Twitter"
"Wed, Sep. 30",Facebook brings Messenger with disappearing messages to Instagram
"Tue, Sep. 29",Facebook names new chief marketer from within
"Tue, Sep. 29",Communication services edges out of correction territory: At the Open
"Fri, Sep. 25",Apple pauses 30% cut on real-world Facebook Events
"Thu, Sep. 24","Senate committee set to subpoena CEOs of Google, Facebook, Twitter over Section 230"
"Thu, Sep. 24","YouTube expands fact-checking, Facebook readies oversight board"
"Wed, Sep. 23",DOJ proposes congressional limits for Internet-company immunity
"Wed, Sep. 23","Facebook, YouTube and Twitter ink deal with advertisers on harmful content"
"Tue, Sep. 22",Facebook not planning to exit Europe in face of regulator challenge - exec
"Tue, Sep. 22","Megacaps holding up against major levels, despite weakness: At the Open"
"Tue, Sep. 22",Facebook gains after Oppenheimer hikes price target off advertising recovery confidence
"Mon, Sep. 21",Facebook says EU business at risk from regulatory action - report
"Sat, Sep. 19",FAANG reversal and industrial lift may be another signal of renaissance for real economy
"Fri, Sep. 18","Barclays sees valuations at dot-com bubble levels, cuts megacaps"
"Fri, Sep. 18","Instagram, TikTok heads engage as deadlines close in"
"Fri, Sep. 18",Facebook shares in need of resilience to close out week: At the Open
"Fri, Sep. 18",TikTok and WeChat downloads to be barred in U.S. starting Sunday
"Thu, Sep. 17",An antidote for waning tech lurks in materials ETF's biggest winners
"Thu, Sep. 17",Facebook launches Business Suite first to small businesses
"Wed, Sep. 16","Facebook, New York Times team up on augmented-reality journalism"
"Wed, Sep. 16","Facebook launches Project Aria for AR glasses, announces Oculus Quest 2"
"Tue, Sep. 15",FTC prepping possible antitrust suit against Facebook - WSJ
"Tue, Sep. 15",Needham highlights value drivers implying 70% upside for this ad industry player
"Tue, Sep. 15",Kim Kardashian West freezing Instagram and Facebook accounts; shares dip
"Mon, Sep. 14",Facebook buying REI's brand-new HQ for $368M
"Mon, Sep. 14",Internet/platform stocks rise on bullish initiation at KeyBanc
"Mon, Sep. 14","YouTube introduces Shorts, its own TikTok-alike feature"
"Sun, Sep. 13",TikTok rejects Microsoft bid for U.S. operations
"Fri, Sep. 11",Apple loosens App Store rules on game streaming rivals (slightly)
"Thu, Sep. 10",Game-streaming celebrity Ninja returns to Twitch
"Thu, Sep. 10",Facebook harks back to origins with college-only Campus offering
"Wed, Sep. 09",EU regulator orders Facebook to stop transferring user data to America - WSJ
"Fri, Sep. 04","Snap, Zynga, Facebook among biggest beneficiaries of Apple privacy-change reprieve"
"Fri, Sep. 04",Apple market cap falls below $2T; Fab 5 shed $900B in two days
"Thu, Sep. 03",Apple confirms it's delaying privacy measures in iOS 14
"Thu, Sep. 03","Facebook, Twitter flag Trump posts about voting twice"
"Thu, Sep. 03",Apple on pace for biggest one-day drop in market cap in history at $150B
"Thu, Sep. 03",Apple said to delay iOS privacy change upsetting ad market - report
"Thu, Sep. 03",Facebook blocking U.S. political ad purchases week before election
"Tue, Sep. 01",Facebook says it may remove content to reduce regulatory risk
"Tue, Sep. 01",Megacaps looking increasingly Teflon: At the Open
"Tue, Sep. 01",Facebook threatens to pull the plug on news sharing Down Under
"Mon, Aug. 31",Longtime Facebook veteran and partnerships leader resigns
"Mon, Aug. 31",Zuckerberg says Facebook erred in not removing militia post
"Sat, Aug. 29",Publishers face hit from upcoming Apple privacy controls
"Fri, Aug. 28","Facebook, Google withdraw FCC request for undersea cable to Hong Kong"
"Fri, Aug. 28","Facebook's Zuckerberg fires at Apple over App Store, ad changes"
"Fri, Aug. 28",White House interviewing replacements for FTC head - Politico
"Fri, Aug. 28",Facebook allows mainland China ad targeting despite longtime block
"Fri, Aug. 28","Facebook says Apple wouldn't let it notify purchasers about its 30% cut, claimed it was ""irrelevant"""
"Wed, Aug. 26",FAANG (S)? A surging Salesforce makes its case for tech titan inclusion
"Wed, Aug. 26",Facebook says new iOS update could trim in-app ad business by more than half
"Tue, Aug. 25","Facebook adds Shop tab, expands Shops and Instagram checkout; BIGC +21%"
"Tue, Aug. 25","One-third of Americans use TikTok, according to the company"
"Mon, Aug. 24",Facebook gets Street-high target from UBS on shopping potential
"Mon, Aug. 24","Facebook +2% alongside price target increases, Reels praise"
"Sat, Aug. 22",What's powering small cap value ETFs? A relentless US consumer
"Fri, Aug. 21","Facebook losing marketing chief, preparing post-election protections"
"Fri, Aug. 21",Facebook tries to appease regulators with support for data portability
"Thu, Aug. 20","News publishers jump into Apple fray, criticizing App Store terms"
"Thu, Aug. 20",FTC interviews Zuckerberg in its Facebook antitrust probe - Politico
"Thu, Aug. 20",Facebook wins court approval to settle biometric privacy lawsuit
"Wed, Aug. 19","Facebook cracks down on content, accounts linked to QAnon theory with new violence policy"
"Tue, Aug. 18",Facebook will remove Trump posts for violations - COO Sandberg
"Mon, Aug. 17",Buffett finds profits - not religion - in GOLD. But other miners may warrant more attention
"Mon, Aug. 17","Melvin Capital picks Google, Docusign, slashes Amazon, Netflix stake"
"Mon, Aug. 17","Whale Rock adds Square, NXP Semiconductors; sheds Intel, Walt Disney"
"Sun, Aug. 16",Instagram to embed Facebook messenger functionality
"Sat, Aug. 15","Lone Pine Capital exits BABA, adds Booking"
"Sat, Aug. 15","Saudi Wealth Fund switches investment to ETFs from blue-chip stocks, exits Boeing, Citi, Facebook"
"Sat, Aug. 15","Duquesne adds JPMorgan, exits Abbott, cuts Alphabet"
"Fri, Aug. 14",Appaloosa (David Tepper) adds new stakes in AT&T; trims Facebook position
"Fri, Aug. 14","3G Capital buys stakes in Fastly, Zoom, while sheds Alibaba, Facebook"
"Fri, Aug. 14","Facebook criticizes Apple store fees, joining growing dispute"
"Fri, Aug. 14","Baupost hedge fund sheds Cheniere Energy, trims stakes in Colony Capital, PG&E, Univar, Facebook"
"Wed, Aug. 12","Facebook, Snap held talks to buy TikTok rival Dubsmash - report"
"Tue, Aug. 11",Facebook policy hits political content disguised as news - Axios
"Mon, Aug. 10","Second-half Internet stocks: More of the new trends, Baird says"
"Mon, Aug. 10","Shell Asset adds Microsoft, cuts Apple, exits Anglogold Ashanti"
"Sat, Aug. 08",How will stocks perform under different U.S. election scenarios?
"Fri, Aug. 07",Facebook relaxed misinfo rules for conservatives - NBC News
"Fri, Aug. 07",IZEA marketplace Shake adds Instagram Reels alongside TikTok
"Fri, Aug. 07",Sanders goes after pandemic wealth gains as Biden moves closer on taxes
"Thu, Aug. 06",Facebook extends remote work policy to summer 2021
"Thu, Aug. 06",Snap pares losses as top TikTok personality looks more to Snapchat
"Thu, Aug. 06",Social stocks diverge after report of Microsoft's interest in all of TikTok
"Thu, Aug. 06","Facebook, Twitter, YouTube remove Trump posts over coronavirus misinformation"
"Wed, Aug. 05",Instagram tackles TikTok challenge with debut of Reels feature
"Mon, Aug. 03",Vornado Realty leases Farley Building to Facebook
"Sat, Aug. 01","Apple, Amazon, Microsoft, Google and Facebook confound index skeptics, as their earnings beats drive the S&P 500 to even greater concentration"
"Sat, Aug. 01",Megacap tech surge forces a rethink: fundamentals or multiple expansion?
"Sat, Aug. 01",TikTok rescue by Microsoft could make sense - Wedbush
"Fri, Jul. 31","With Facebook boycott wrapping, GM says it's not resuming ad spend; what about other brands?"
"Fri, Jul. 31",Facebook launching music videos this weekend
"Fri, Jul. 31",Social stocks mostly calm amid Microsoft-TikTok talk
"Fri, Jul. 31","Facebook surge leads tech megacaps higher, but Alphabet stumbles"
"Fri, Jul. 31",Facebook analysts cautious on ad revenue growth
"Fri, Jul. 31","Australia to force Google, Facebook to pay for news content"
"Fri, Jul. 31",Facebook finally securing rights to music videos - Bloomberg
"Thu, Jul. 30","Big tech - Apple, Amazon, Facebook, Alphabet show rally was no fluke?"
"Thu, Jul. 30","Search trends point to ongoing interest in games, e-commerce"
"Thu, Jul. 30","Facebook +1.6% as ad revenues, users drive easy Q2 beat"
"Thu, Jul. 30","Facebook EPS beats by $0.40, beats on revenue and active users, shares +5%"
"Thu, Jul. 30","Amazon, Google, Apple and Facebook report earnings after the close"
"Wed, Jul. 29",Facebook Q2 2020 Earnings Preview
"Wed, Jul. 29",Key House tech antitrust hearing under way after delay (updated)
"Wed, Jul. 29","CEOs of Amazon, Google, Apple and Facebook testify before Congress"
"Tue, Jul. 28",Instagram making 'lucrative offers' to TikTok creators - WSJ
"Mon, Jul. 27","Facebook moves earnings to Thursday, with Zuckerberg's conflict"
"Sun, Jul. 26","Ahead of testimony, Facebook, Twitter, Snapchat under fire from Presidential campaigns"
"Sat, Jul. 25",House's tech antitrust hearing reset for Wednesday
"Fri, Jul. 24",House delays high-profile tech antitrust hearing
"Fri, Jul. 24",House's tech-antitrust hearing likely headed for delay
"Thu, Jul. 23",Facebook proposing $650M to settle class-action case over biometrics
"Thu, Jul. 23","Twitter +7.9% as monetizable users, subscription potential steal focus from ad-sales disappointment"
"Thu, Jul. 23",Telecom takes a first step in helping sector as a whole
"Wed, Jul. 22",Facebook expected to join Twitter in action against QAnon theories
"Wed, Jul. 22",Reinvention separates megacaps from dot-com’s winners – JMP’s Lehmann
"Wed, Jul. 22",WhatsApp testing credit offering to India users - TechCrunch
"Wed, Jul. 22",Energy stocks giving back gains as inventory concerns rise
"Tue, Jul. 21",Snap remarks offer lens into Q3 expectations; social stocks dip
"Sat, Jul. 18","Disney, Facebook's No.1 advertiser, slashes its spend"
"Fri, Jul. 17","FTC could depose Zuckerberg, Sandberg in Facebook probe - WSJ"
"Thu, Jul. 16","Twitter hack, Disney downgrade dent Communication Services"
"Thu, Jul. 16",Facebook preps global launch of TikTok competitor - NBC
"Thu, Jul. 16",EU top court strikes down data-sharing deal with U.S.
"Wed, Jul. 15",These big tech names are integral to Fund's S&P-beating strategy
"Wed, Jul. 15","Facebook, Sony boost game hardware production to feed hungry market - Nikkei"
"Tue, Jul. 14","Google favoring YouTube results over rivals, WSJ says"
"Mon, Jul. 13","Jefferies raises targets on Facebook, rivals amid improving ad market"
"Mon, Jul. 13",Megacaps rejoin the party with stocks set for broad-based rally
"Sat, Jul. 11","Deconstruct FAANG stocks, and the 'N' should be replaced with another"
"Fri, Jul. 10",Facebook mulls political ad blackout before U.S. election - Bloomberg
"Fri, Jul. 10",Social Capital CEO builds short case for Facebook and Alphabet
"Thu, Jul. 09",Supreme Court will review Facebook's unsolicited text appeal
"Wed, Jul. 08",Facebook civil rights audit dings 'weaponized' platform
"Tue, Jul. 07",Facebook meeting disappointed civil rights groups
"Tue, Jul. 07",Facebook accused of 'unkept promises' by the DNC
"Tue, Jul. 07",Social media stocks in focus as Facebook faces day of diplomacy
"Tue, Jul. 07",Facebook 'stands firmly against hate' - Sandberg
"Tue, Jul. 07",Facebook meets with social justice leaders over boycott
"Mon, Jul. 06",Instagram testing Reels feature in India
"Mon, Jul. 06","Facebook, WhatsApp stop processing Hong Kong data requests"
"Fri, Jul. 03","Twitter, Facebook to face free speech test in Hong Kong"
"Fri, Jul. 03",Sony PlayStation pulls ads from Facebook until end of month
"Fri, Jul. 03",Facebook adds banners to encourage mask wearing
"Thu, Jul. 02","Facebook's Zuckerberg, Sandberg set Tuesday meeting with boycott organizers"
"Thu, Jul. 02","Facebook to discontinue Lasso, TikTok clone"
"Thu, Jul. 02",Facebook ad boycott could stretch until November - Needham
"Thu, Jul. 02",Big Tech CEOs set to testify before Congress
"Wed, Jul. 01",Facebook's Zuckerberg expects advertisers back 'soon enough' - report
"Wed, Jul. 01",Facebook agrees to brand-safety audit - Adweek
"Wed, Jul. 01",Constellation Brands joins the list of companies halting ads on social media
"Wed, Jul. 01",Twitch cementing dominance with new record quarter - report
"Wed, Jul. 01","Facebook responds to boycott, offers to meet with organizers; shares rising"
"Tue, Jun. 30",Gaming and Internet ETFs top the competition in historic first half
"Tue, Jun. 30",Facebook calls mass meeting of advertisers amid boycott
"Mon, Jun. 29",Chinese Internet giants stride as U.S. counterparts face headwinds
"Mon, Jun. 29",HP pulls its U.S. Facebook ads
"Mon, Jun. 29",Microsoft pauses global Facebook ads - Axios
"Mon, Jun. 29",Several more advertisers pull social media ad spending
"Mon, Jun. 29",Clorox cutting Facebook advertising through December
"Mon, Jun. 29",Social media stocks keep sliding premarket on revenue concerns
"Mon, Jun. 29","Buy the dips in Facebook, says sell-side bull"
"Mon, Jun. 29",Facebook ad boycott campaign set to go global
"Sun, Jun. 28",Starbucks joins companies stopping ads on social media
"Sat, Jun. 27","Diageo, following peers, takes a step back from social media"
"Fri, Jun. 26",Hershey pauses advertising on Facebook and Instagram
"Fri, Jun. 26",Coca-Cola to pause all social media advertising
"Fri, Jun. 26",Facebook and financials send Wall Street reeling
"Fri, Jun. 26","Zuckerberg announces Facebook policies on voting info, hate speech"
"Fri, Jun. 26",P&G review could be new bombshell for digital ad companies
"Fri, Jun. 26","Unilever halting ads on Facebook, Twitter for 2020"
"Fri, Jun. 26",Facebook looks to contain spread of ad boycott; shares -6.4%
"Thu, Jun. 25",Verizon pausing Facebook ads as boycott gains momentum
"Thu, Jun. 25","Baird lifts Facebook, Alphabet targets on ad recovery"
"Wed, Jun. 24",Google weighs alternatives for Hong Kong undersea cable
"Tue, Jun. 23",Big 5 tech stocks rallying further to new highs
"Tue, Jun. 23",Facebook shuts down entry-level Oculus Go VR headset
"Tue, Jun. 23",Ben & Jerry's considers jumping on the 'boycott Facebook' train
"Mon, Jun. 22",Direxion gives details on WFH ETF
"Mon, Jun. 22","Microsoft closing Mixer, moving content to Facebook Gaming"
"Mon, Jun. 22","Patagonia, REI join Facebook ad boycott"
"Fri, Jun. 19",The North Face joins ad boycott of Facebook
"Fri, Jun. 19",Dentsu agency urges clients to support Facebook ad boycott
"Thu, Jun. 18",Stocks end choppy day right at flatline
"Thu, Jun. 18",Facebook pulls Trump campaign ad featuring controversial symbol
"Thu, Jun. 18",Facebook files suits tied to use of automation software
"Thu, Jun. 18",France calls U.S. withdrawal from digital tax talks a 'provocation'
"Wed, Jun. 17",J.P. Morgan shores up top picks in online ad rebound
"Wed, Jun. 17",DOJ proposals against online platforms could come today - WSJ
"Wed, Jun. 17",Facebook's Jio investment under antitrust review
"Tue, Jun. 16",Facebook sharpens transparency rule to close political-ad loophole
"Tue, Jun. 16","House Intel panel to hear from Facebook, Google, Twitter"
"Mon, Jun. 15",Oppenheimer weighs potential bidders for AT&T's games business
"Mon, Jun. 15",Visa helps launch payments on WhatsApp in Brazil
"Mon, Jun. 15",WhatsApp launches digital payments in Brazil
"Mon, Jun. 15",Main Street has killed Wall Street during this rally. Here are the stocks they're buying
"Sat, Jun. 13",Grantham on 'fourth great stock market event' in his career
"Fri, Jun. 12","DOJ, FTC fighting over handling Facebook/Giphy probe - Politico"
"Fri, Jun. 12",Facebook pausing Giphy integration amid probe - Reuters
"Fri, Jun. 12","Facebook, Giphy deal probed by UK regulator"
"Fri, Jun. 12",What is free speech on social media?
"Thu, Jun. 11",Cox returns as Facebook head of product
"Thu, Jun. 11",Facebook establishing a 'multi-million dollar' venture fund
"Wed, Jun. 10","Higher online media targets from BofA, as trends look up"
"Tue, Jun. 09","Gundlach sees stocks falling, gold rising despite 'Superman' Powell's heavy lifting"
"Tue, Jun. 09","Goldman raises Facebook target on Shops, Checkout potential"
"Sat, Jun. 06",Zuckerberg pledges to review some Facebook content policies
"Fri, Jun. 05",Facebook slaps labels on state-controlled media
"Thu, Jun. 04",Why isn't Facebook using Oversight Board for Trump posts?
"Wed, Jun. 03",Snapchat stops promoting Trump content after comments
"Wed, Jun. 03","Facebook and PayPal invest in Indonesian ride-hailing, payments app"
"Wed, Jun. 03",U.S. launches probe into foreign digital taxes
"Tue, Jun. 02",Zuckerberg defends easy approach on Trump posts
"Mon, Jun. 01","Walkout underway at Facebook, virtually, in protest of policies"
"Mon, Jun. 01","Trump, Zuckerberg talk amid social media crackdown"
"Thu, May 28",Trump signs executive order targeting social media
"Thu, May 28","Twitter doubles down on labeling, even under threat"
"Thu, May 28",Google reportedly exploring stake in Vodafone Idea
"Thu, May 28",Zuckerberg responds to threats against social media
"Thu, May 28",Trump order to enable punishment for social media - WP
"Wed, May 27",Trump to sign executive order on social media tomorrow - WH
"Wed, May 27",'Almost thrown in the towel' -- Novogratz on fighting the tape
"Wed, May 27","In volatile market, Morgan Stanley chooses secular growth winners"
"Wed, May 27",Stay-at-home selloff continues as economy revs up
"Wed, May 27",Facebook Shops could bring $7B profits by 2023 - Citi
"Wed, May 27",President threatens social media companies
"Sun, May 24","JioMart online grocery service takes on Amazon, Flipkart"
"Sat, May 23",Tech giants could be under review for online bias
"Thu, May 21",Facebook shifting more permanently to remote work
"Thu, May 21",Facebook +2.3% as Stifel bumps price target
"Thu, May 21",Big tech has a big problem in D.C.
"Wed, May 20",Amazon makes its move into big-budget gaming
"Wed, May 20",10 rules to return to the Facebook office
"Tue, May 19",Visa employees granted WFH status through year end
"Tue, May 19",Facebook +3.1% as it rolls out Shops feature
"Tue, May 19","Facebook, HP Inc. hit highs after Najarian's options mention"
"Tue, May 19",Disney -1.2% as Loop moves to sideline
"Mon, May 18",General Atlantic follows Facebook and Vista Equity with Jio investment
"Sat, May 16","Trump tweet raises threat for Google, Twitter, Facebook"
"Sat, May 16","Appaloosa Management buys Twitter, exits Caesars, cuts Facebook"
"Sat, May 16",Saudi sovereign Fund adds Facebook and Disney to holdings
"Fri, May 15",Facebook buying GIPHY for $400M
"Fri, May 15",Facebook price target hiked on revenue potential
"Fri, May 15","Baupost moves: Adds Alphabet, Facebook; exits Bristol Myers Squibb"
"Thu, May 14",Facebook's African internet project moves forward
"Thu, May 14",Only an hour to delete criminal content in France
"Wed, May 13","Despite spending slowdown, Nomura sees cloud computing boost in pandemic"
"Tue, May 12",Facebook paying $52M settlement to moderators
"Tue, May 12",'Forever' work from home a reality now at Twitter
"Tue, May 12",'No doubt' economy is 'divorced' from stock and bond markets - Social Capital CEO
"Fri, May 08",Facebook unveils redesigned desktop site
"Thu, May 07",Facebook allowing work-from-home through year-end for most - CNBC
