Date,Headlines
"Wed, Aug. 31, 2016","Leon Cooperman concerned Apple's 'best days might be behind it,' prefers Facebook, Alphabet"
"Wed, Aug. 31, 2016",Facebook launching satellite to 'beam down connectivity' for sub-Saharan Africa
"Tue, Aug. 30, 2016",Facebook news roundup
"Fri, Aug. 26, 2016",Facebook's trending content to now be algorithmically generated
"Fri, Aug. 26, 2016",WhatsApp's new privacy policy under inspection at UK regulatory agency
"Thu, Aug. 25, 2016",WhatsApp updates terms to enable communication between people and businesses
"Thu, Aug. 25, 2016",Apple reportedly developing in-house video application
"Tue, Aug. 23, 2016",Facebook testing autoplay video with sound on by default
"Mon, Aug. 22, 2016",Data reads show Pokémon Go peaked
"Mon, Aug. 22, 2016",Facebook records 1.5B Olympics-related interactions from 277M people
"Mon, Aug. 22, 2016",Instagram registers 1B Google Play installs
"Thu, Aug. 18, 2016",Facebook announces Unity Technologies partnership to streamline game publishing
"Tue, Aug. 16, 2016","WhatsApp's Indian rival raises $175M, valued at $1.4B"
"Mon, Aug. 15, 2016",Instagram rolling out new business tools
"Fri, Aug. 12, 2016",Video 'Channels' spotted on Instagram
"Thu, Aug. 11, 2016",Facebook's new ad-blocking restrictions claimed to be foiled
"Thu, Aug. 11, 2016",Facebook adds new 'signals' to News Feed ranking criteria
"Wed, Aug. 10, 2016","Facebook reveals new video metrics, 360 video publisher tools"
"Tue, Aug. 09, 2016",WSJ: Procter & Gamble scaling down targeted Facebook ads
"Tue, Aug. 09, 2016","Facebook enhances ad-customization controls, plans to override ad-blocking software"
"Mon, Aug. 08, 2016","Facebook partners with global broadcasters, National Olympic Committees and the International Olympic Committee"
"Mon, Aug. 08, 2016","SunTrust Robinson Humphrey analyst Robert Peck on Instagram Stories; asserts Facebook, Snapchat 'collision course'"
"Thu, Aug. 04, 2016",Facebook adjusts News Feed algorithm to reduce clickbait
"Wed, Aug. 03, 2016",Facebook reveals 'Area 404' hardware lab
"Wed, Aug. 03, 2016",Facebook to live-stream today's Manchester United vs. Everton match
"Fri, Jul. 29, 2016",Facebook 10-Q: $3B-$5B potential IRS tax liability
"Fri, Jul. 29, 2016",Facebook now 5th most valuable company in the world
"Wed, Jul. 27, 2016","Facebook beats by $0.15, beats on revenue"
"Fri, Jul. 22, 2016",Facebook bull rings the register
"Wed, Jul. 20, 2016",Facebook's Messenger reaches 1B active user milestone
"Wed, Jul. 20, 2016",Google may be shutting down its initiative to create a standalone VR headset
"Tue, Jul. 19, 2016",Faceboook's WhatsApp ban in Brazil suspended
"Tue, Jul. 19, 2016",Facebook's WhatsApp blocked in Brazil
"Tue, Jul. 19, 2016",Three lunchtime reads
"Thu, Jul. 14, 2016",Facebook to integrate Instant Articles within Messenger
"Thu, Jul. 07, 2016",IRS probes Irish asset transfers at Facebook
"Wed, Jul. 06, 2016",Facebook hires former Tesla products chief for hardware role
"Mon, Jul. 04, 2016",Facebook defends extremist content standards
"Fri, Jul. 01, 2016","Messenger now has 11,000 bots on its platform"
"Tue, Jun. 28, 2016",Three breakfast reads
"Sun, Jun. 26, 2016","Google, Facebook deploy automation to block extremist content"
"Fri, Jun. 24, 2016",Facebook hires Google Fiber co-founder for connectivity team
"Tue, Jun. 21, 2016",Facebook ups video game
"Tue, Jun. 21, 2016","SunTrust: Snapchat minor but growing threat to Facebook, Twitter"
"Tue, Jun. 21, 2016",Instagram tops half a billion users
"Mon, Jun. 20, 2016",Facebook shareholders OK stock shift that keeps Zuckerberg in charge
"Mon, Jun. 20, 2016",Zuckerberg's majority control is up for vote
"Fri, Jun. 17, 2016",Three breakfast reads
"Mon, Jun. 13, 2016",Citron goes short Facebook
"Mon, Jun. 13, 2016",Facebook activates Safety Check for first time in U.S.
"Fri, Jun. 03, 2016",Facebook board seeks curb in Zuckerberg control
"Wed, Jun. 01, 2016",Facebook's Sandberg on Disney CEO chatter: 'I don't want another job'
"Sun, May 29, 2016",Who is winning the social media battle for news consumption?
"Fri, May 27, 2016",Facebook expands third-party ads to those who don't use Facebook
"Thu, May 26, 2016",Facebook looking for new CIO as Campos plans departure
"Thu, May 26, 2016","Microsoft, Facebook to build highest-capacity trans-Atlantic cable"
"Wed, May 25, 2016",Facebook is shuttering its FBX ad exchange; Criteo slumps in response
"Wed, May 25, 2016","Report: Microsoft prepping cheaper Xbox One for 2016, VR-capable model for 2017 (updated)"
"Tue, May 24, 2016",Facebook makes changes to trending topics feature
"Mon, May 23, 2016","Cheetah Mobile down 32% post-earnings amid downgrades, Facebook algorithm worries"
"Mon, May 23, 2016",Facebook buys a virtual reality audio firm to strengthen Oculus
"Thu, May 19, 2016",Results from Facebook's political conclave
"Mon, May 16, 2016",Facebook to sell video ads for other companies
"Mon, May 16, 2016","Cooperman sells Citigroup, Facebook, Google; adds others"
"Mon, May 16, 2016",Zuckerberg to meet conservatives on political bias flap
"Fri, May 13, 2016","Tepper's 13F: New stakes in FB, FOX, BAC; VRX stake already dissolved"
"Fri, May 13, 2016",Facebook hires northern California judge to oversee litigation
"Fri, May 13, 2016",Zuckerberg addresses 'trending news' concerns
"Wed, May 11, 2016",Senate committee presses Facebook over news selection
"Sun, May 08, 2016",Facebook loses virtual reality innovator
"Wed, May 04, 2016",Silicon Valley privacy fight heats up in Brazil
"Thu, Apr. 28, 2016",Facebook up 10.9% as sell-side rushes to lift targets
"Wed, Apr. 27, 2016",Facebook plans to split stock via new share class; shares surge on Q1 beat
"Wed, Apr. 27, 2016","Facebook beats by $0.15, beats on revenue"
"Mon, Apr. 25, 2016",WSJ: Facebook is developing a standalone camera app
"Mon, Apr. 25, 2016",Facebook works to cut tech prices to help boost growth
"Tue, Apr. 19, 2016",Facebook gains as ad partner reports strong Q1 numbers ahead of earnings
"Mon, Apr. 18, 2016","Credit Suisse expecting big upside from Facebook, Amazon, Google"
"Fri, Apr. 15, 2016",Apple reportedly weighs App Store search ads that would compete with Facebook/Google
"Thu, Apr. 14, 2016","Facebook: user growth is massive, but messenger monetization is still early days - Deutsche Bank"
"Tue, Apr. 12, 2016","Zuck reveals chatbot platform, drone livestreaming, headset plans at Facebook's F8"
"Tue, Apr. 12, 2016",Here comes Facebook's F8 developer conference
"Fri, Apr. 08, 2016",These giants are Credit Suisse's 3 top internet stock picks
"Mon, Apr. 04, 2016",Oculus Rift hits speed bump with shipping delays
"Sat, Apr. 02, 2016",Are millennials abandoning Facebook? Not so much
"Sat, Apr. 02, 2016","Facebook backs off from its bid to stream NFL games, Verizon, Yahoo and Amazon still contenders"
"Tue, Mar. 29, 2016",Oculus Rift pre-orders begin shipping
"Mon, Mar. 28, 2016",Facebook gets price target boost at Evercore ISI
"Mon, Mar. 21, 2016",Zuckerberg meets with China's propaganda chief
"Fri, Mar. 18, 2016",Report: Yahoo is thinking of letting Facebook sell ads within Tumblr's app
"Fri, Mar. 18, 2016","Facebook, Twitter fight to stream live TV"
"Mon, Mar. 14, 2016",Baird: Facebook partner data points to accelerating Q1 sales growth
"Wed, Mar. 09, 2016",RBC: Google and Facebook are as dominant as ever in online advertising (updated)
"Mon, Mar. 07, 2016",Report: Snapchat aiming for 2016 revenue of $300M-$350M
"Mon, Mar. 07, 2016","Facebook pulls plug on ad-buying service test, cites ""bad ads and fraud"""
"Fri, Mar. 04, 2016",Facebook switches U.K. tax billing structure
"Wed, Mar. 02, 2016",Facebook tops 3M advertisers (more than 20x as many as Twitter)
"Mon, Feb. 29, 2016","Zuck talks virtual reality and A.I., reportedly ""obsessed"" with livestreaming"
"Wed, Feb. 24, 2016","Facebook rolls out Reactions; five new ""emotions"" complement Like button (updated)"
"Tue, Feb. 23, 2016",Facebook still committed to expanding Internet access
"Fri, Feb. 12, 2016","Facebook explores line between public safety, free speech"
"Mon, Feb. 08, 2016","India imposes net neutrality rules, bans Facebook's Free Basics service"
"Fri, Feb. 05, 2016","FB, AMZN, other Internet stocks down big following LinkedIn's earnings"
"Tue, Feb. 02, 2016",WhatsApp joins the billion users club
"Thu, Jan. 28, 2016",Facebook up 15.6% post-earnings; analysts gush over Instagram's growth
"Thu, Jan. 28, 2016",Energy stocks rise premarket as crude moves higher
"Wed, Jan. 27, 2016",Facebook sets 2016 spending guidance; shares now up 12.3%
"Wed, Jan. 27, 2016",Facebook surges above $100 after Q4 beat; ad revenue rises 57%
"Wed, Jan. 27, 2016","Facebook beats by $0.11, beats on revenue"
"Thu, Jan. 21, 2016",Facebook launches sports platform; ad partner reports strong Q4 data
"Wed, Jan. 20, 2016",Tech giants fall sharply as Nasdaq tumbles
"Mon, Jan. 18, 2016",WhatsApp axes subscription fee
"Tue, Jan. 12, 2016",Report: Google creating virtual reality unit to battle Facebook/Oculus
"Thu, Jan. 07, 2016",Facebook Messenger tops 800M active users; 2016 agenda discussed
"Wed, Jan. 06, 2016","Facebook prices Oculus Rift at $599, launches SDK for Messenger bots"
"Tue, Jan. 05, 2016",What will be the price tag on the Oculus Rift?
"Mon, Jan. 04, 2016",Is Mark Zuckerberg the next Iron Man?
"Wed, Dec. 30, 2015",Facebook must face class actions over IPO
"Tue, Dec. 29, 2015","Facebook experimenting with multiple news feeds, shopping marketplace"
"Sun, Dec. 20, 2015","Nielsen: Facebook, Google have the 8 most popular U.S. mobile apps"
"Wed, Dec. 16, 2015",Facebook strikes deal with Uber to enable ride requests via Messenger
"Tue, Dec. 15, 2015","Facebook preps local services site, takes on Yelp/Angie's List"
"Tue, Dec. 15, 2015",Twitter lower after Evercore cuts target on weak traffic data; Instagram growing faster (updated)
"Thu, Dec. 10, 2015",Nvidia's Tesla GPUs designed into Facebook A.I. computing platform
"Mon, Dec. 07, 2015","Facebook shutters Creative Labs initiative, Snapchat rival, Rooms app"
"Fri, Dec. 04, 2015",Pandora adds to losses after pricing debt offering; Facebook challenges Ticketfly
"Tue, Dec. 01, 2015",Zuckerberg plans to donate 99% of Facebook stake over lifetime
"Mon, Nov. 23, 2015",Rough time for hedge fund hotels
"Sun, Nov. 22, 2015","Zuckerberg to take paternity leave, doesn't name replacement"
"Sun, Nov. 15, 2015",Marc Andreesen is selling out his stake in Facebook
"Thu, Nov. 12, 2015","Facebook brings 360° videos to iOS; AT&T, Disney buying ads"
"Mon, Nov. 09, 2015","Snapchat plays catch-up with FB, triples video traffic"
"Thu, Nov. 05, 2015",Facebook to launch Notify app next week
"Wed, Nov. 04, 2015","Facebook's call touches on video views, mobile use, ad prices, China; shares +3.8%"
"Wed, Nov. 04, 2015",Facebook's ad revenue grows 45% Y/Y; MAUs hit 1.55B
"Wed, Nov. 04, 2015","Facebook beats by $0.05, beats on revenue"
"Sat, Oct. 24, 2015",Facebook makes its 2 trillion+ posts available for search
"Thu, Oct. 15, 2015","Facebook higher after Argus upgrades, sets $115 target"
"Wed, Oct. 14, 2015",Facebook deepens YouTube rivalry
"Mon, Oct. 12, 2015",Shopify down sharply as Facebook tests Shopping feed
"Fri, Oct. 09, 2015",Twitter launches YouTube-like video ad service; shares up 16% on the week (updated)
"Thu, Oct. 08, 2015","Facebook tests Reactions emojis instead of ""dislike"" button; advertisers approve"
"Tue, Oct. 06, 2015",Facebook to beam Internet from space
"Mon, Sep. 28, 2015","Facebook goes after TV ad dollars with new buying options, Nielsen deal"
"Fri, Sep. 25, 2015",New Gear VR priced at $99
"Thu, Sep. 24, 2015",Facebook unveils 360-degree video
"Wed, Sep. 23, 2015",Instagram cruises past 400M users
"Fri, Sep. 18, 2015",Facebook to start using Like and Share buttons for ad targeting
"Tue, Sep. 15, 2015","Zuck confirms plans for Facebook ""dislike"" button, sees ""golden age of video"" arriving"
"Wed, Sep. 09, 2015","Facebook takes Instagram ads global, launches several new ad options"
"Fri, Sep. 04, 2015",WhatsApp tops 900M active users; Instagram ad load grows
"Thu, Sep. 03, 2015","Facebook improves ad measurement, begins testing interactive mobile ads"
"Thu, Aug. 27, 2015","Facebook first: 1B people use it in a single day, Zuckerberg says"
"Wed, Aug. 26, 2015",Facebook unveils human-supported Siri/Google Now alternative called M
"Mon, Aug. 24, 2015",Tech stocks setting up for dismal day
"Tue, Aug. 11, 2015","Facebook expands mobile video ad reach, reportedly preps breaking news app"
"Thu, Aug. 06, 2015","Facebook begins livestreaming, but only for celebrities"
"Fri, Jul. 31, 2015",Facebook shows off 'Aquila' Internet drone
"Wed, Jul. 29, 2015","Facebook -3.3% after earnings call; sales growth, spending, usage discussed"
"Wed, Jul. 29, 2015",Facebook down 2.4% after Q2 beat; MAUs rise to 1.49B
"Wed, Jul. 29, 2015","Facebook beats by $0.03, beats on revenue"
"Wed, Jul. 22, 2015",Facebook market cap now larger than GE
"Fri, Jul. 17, 2015","FB, LNKD, PCLN up strongly after Google's earnings; Facebook tops $95"
"Thu, Jul. 16, 2015",Facebook/Oculus buy gesture-recognition firm for reported ~$60M
"Wed, Jul. 15, 2015","Facebook ad partner reports lower Q2 ad click prices, strong click growth"
"Wed, Jul. 08, 2015","Facebook rethinks ad pricing, will no longer charge for likes/shares/comments"
"Tue, Jul. 07, 2015",Facebook spending at least $500M to build Texas data center
"Wed, Jul. 01, 2015","Facebook preps Suggested Videos feature, video ad revenue-sharing"
"Thu, Jun. 25, 2015",Importance of video growing at Facebook
"Wed, Jun. 24, 2015",Facebook makes Messenger available to non-Facebook users
"Tue, Jun. 23, 2015",Facebook takes out March highs amid Instagram/mobile ad news
"Mon, Jun. 22, 2015",Piper hikes Facebook target to $120; shares rise
"Mon, Jun. 15, 2015",RBC: Facebook's video ad opportunity on par with mobile
"Thu, Jun. 11, 2015",Facebook/Oculus partners with Microsoft; Xbox One games coming to Rift
"Wed, Jun. 10, 2015","Facebook news: Messenger downloads/games, Instagram, Shopify deal"
"Thu, Jun. 04, 2015",Facebook launches no-frills app for emerging markets users
"Tue, Jun. 02, 2015","Facebook gives Instagram shopping tool, app install ads, better targeting, API"
"Wed, May 27, 2015",Snapchat CEO: 'We need to IPO'
"Thu, May 21, 2015",Goldman updates list of most-held hedge fund names
"Mon, May 18, 2015",Facebook talks WhatsApp monetization; Messenger games reportedly on tap
"Thu, May 14, 2015",Facebook +3.8%; JPMorgan reports strong April comScore data
"Tue, May 12, 2015",Report: NYT-Facebook direct publishing deal set to begin tomorrow
"Tue, May 12, 2015",Facebook hires former FCC chief Martin to head mobile/access policy
"Mon, May 11, 2015",Facebook COO Sandberg returns to work following husband's death
"Wed, May 06, 2015","Facebook partners with IBM on ad targeting, plans Q1 2016 Oculus launch"
"Fri, May 01, 2015","Analysts defend LinkedIn amid plunge, argue non-ad issues are temporary"
"Fri, May 01, 2015",EU to widen probe against U.S. tech companies
"Tue, Apr. 28, 2015",Twitter strikes Google ad deal after weak Q1
"Mon, Apr. 27, 2015",Facebook adds video call support to Messenger apps
"Thu, Apr. 23, 2015",Facebook bulls talk up video growth; spending guidance slightly cut
"Wed, Apr. 22, 2015",Facebook's Q1 ad sales hurt by strong dollar; MAUs up to 1.44B
"Wed, Apr. 22, 2015","Facebook beats by $0.02, misses on revenue"
"Wed, Apr. 22, 2015","Facebook reportedly shows interest in Nokia maps unit, launches dialer app (updated)"
"Sat, Apr. 18, 2015",WhatsApp tops 800M active users; Facebook ad partner sees strong Q1
"Sat, Apr. 11, 2015",Twitter cuts off data firehose access; Facebook happy to step in
"Wed, Apr. 08, 2015",Re/code throws cold water on Twitter buyout rumors
"Tue, Apr. 07, 2015","Turkey briefly bans Twitter, YouTube over hostage crisis"
"Thu, Apr. 02, 2015",Fidelity's Danoff's picks
"Thu, Mar. 26, 2015",Zuckerberg downplays Facebook/Google rivalry
"Wed, Mar. 25, 2015","Facebook launches embedded videos, mobile ad exchange, IoT SDKs"
"Wed, Mar. 25, 2015","Zuck shares stats, launches Messenger app platform at Facebook's F8"
"Tue, Mar. 24, 2015","NYT: Facebook in talks to host publisher articles, share ad revenue (updated)"
"Fri, Mar. 20, 2015",Facebook tops $84; Messenger reportedly turning into developer platform
"Wed, Mar. 18, 2015",eBay down 2.3% in wake of Facebook's payments launch
"Tue, Mar. 17, 2015",Facebook adds payments support to Messenger
"Mon, Mar. 16, 2015",Gurley: Facebook's mobile ad sales vulnerable to startup bubble's bursting
"Fri, Mar. 13, 2015",Facebook buys shopping site to improve e-commerce ad quality
"Sat, Mar. 07, 2015",WSJ: Google building virtual reality version of Android
"Wed, Mar. 04, 2015",Facebook reportedly working on new mobile ad platform; Twitter falls
"Mon, Mar. 02, 2015",HTC unveils virtual reality headset
"Tue, Feb. 24, 2015","Facebook tops 2M advertisers, gives them a new app"
"Thu, Feb. 19, 2015",Facebook +3.7%; Cowen values Instagram at $33B
"Wed, Feb. 18, 2015",Tepper slashed U.S. stock holdings in 2014
"Sat, Feb. 07, 2015",Facebook spends estimated $400M on industrial park
"Wed, Jan. 28, 2015","Facebook's call touches on spending plans, video, forex, search"
"Wed, Jan. 28, 2015","Facebook's Q4 highlights: 53% ad growth, 1.39B MAUs"
"Wed, Jan. 28, 2015","Facebook beats by $0.06, beats on revenue"
"Thu, Jan. 15, 2015",Facebook rolls out free-Internet app in Colombia; what about China?
"Wed, Jan. 14, 2015",Facebook at Work launches in test mode; $100+ targets arrive
"Tue, Jan. 06, 2015",WhatsApp tops 700M active users
"Mon, Jan. 05, 2015",Facebook buys voice recognition tech developer
"Mon, Jan. 05, 2015",Facebook bucks tech selloff following BofA target hike
"Fri, Jan. 02, 2015","Wilson's 2015 predictions: Tech stocks, wearables, cybersecurity, Bitcoin"
"Wed, Dec. 24, 2014",Facebook signs video clips deal with NFL
"Mon, Dec. 22, 2014",Facebook takes out October highs
"Fri, Dec. 19, 2014",Citi values Instagram at $35B
"Tue, Dec. 16, 2014","Facebook, Twitter, Amazon headline Internet stock selloff"
"Sat, Dec. 13, 2014",Facebook dumps Microsoft's Bing search
"Thu, Dec. 11, 2014","Facebook's Oculus buys two startups; Zuck open to ""dislike"" button"
"Wed, Dec. 10, 2014",Instagram tops 300M active users
"Mon, Dec. 08, 2014","Facebook overhauls search engine, brings Graph Search to mobile"
"Fri, Dec. 05, 2014",Facebook sees Atlas giving Instagram's ad sales a boost
"Wed, Nov. 26, 2014","Facebook, Twitter, other Internet stocks rally"
"Tue, Nov. 25, 2014",What did the billionaires do in Q3?
"Tue, Nov. 18, 2014",Facebook launches standalone Groups apps
"Mon, Nov. 17, 2014","LinkedIn, Jive, Salesforce lower following Facebook at Work report"
"Mon, Nov. 17, 2014",Facebook developing website for professionals
"Thu, Nov. 13, 2014","Facebook updates privacy policy, sets stage for payments push"
"Mon, Nov. 10, 2014",Facebook Messenger tops 500M MAUs
"Sat, Nov. 08, 2014","Zuck: Facebook optimizes news feed for users, not businesses"
"Thu, Oct. 30, 2014",Instagram video ads launch
"Wed, Oct. 29, 2014",Facebook files mixed shelf registration
"Wed, Oct. 29, 2014",Sell-side on Facebook: Weakness a buying opportunity
"Tue, Oct. 28, 2014","Facebook talks spending, ad prices/measurement, Oculus on CC"
"Tue, Oct. 28, 2014","Facebook -8.4% AH on revenue, spending guidance"
"Tue, Oct. 28, 2014",Facebook's ad sales continue surging; spending picks up
"Tue, Oct. 28, 2014","Facebook beats by $0.03, beats on revenue"
"Thu, Oct. 23, 2014","Facebook launches Rooms app, lets users rely on pseudonyms"
"Mon, Oct. 20, 2014",Contrafund boosts bet on Facebook
"Fri, Oct. 17, 2014",Facebook's market cap tops IBM's; partner reports strong Q3 numbers
"Wed, Oct. 15, 2014","Google, Facebook, Amazon, others slide following Netflix/eBay's results"
"Tue, Oct. 14, 2014",Goldman: Every client asking about the same four things
"Tue, Oct. 07, 2014","Facebook roundup: Anonymous app, mobile ad network, Atlas"
"Mon, Oct. 06, 2014",Facebook closes WhatsApp acquisition
"Fri, Oct. 03, 2014",Facebook's acquisition of WhatsApp approved by EU
"Fri, Oct. 03, 2014",Facebook plans entry into healthcare
"Mon, Sep. 29, 2014","Facebook roundup: Atlas, Instagram, Ello"
"Thu, Sep. 25, 2014","Facebook roundup: WhatsApp, Stifel, Messenger"
"Tue, Sep. 23, 2014",Facebook goes after Google with new ad tech platform
"Sat, Sep. 20, 2014","eMarketer: Facebook's U.S. usage still growing, monetization outperforms"
"Fri, Sep. 12, 2014",WSJ: Facebook pitching to lure content creators away from YouTube
"Thu, Sep. 11, 2014","Apple back above $600B in market cap, Exxon hangs on vs. Google for no. 2"
"Wed, Sep. 03, 2014",Facebook's Oculus teams with Samsung to launch Gear VR headset
"Tue, Sep. 02, 2014",EU antitrust authorities solicit feedback for WhatsApp deal
"Mon, Sep. 01, 2014","EU regulators set Oct. 3 deadline to decide on Facebook, WhatsApp deal"
"Wed, Aug. 27, 2014","Janney downgrades Facebook, cites valuation and growth"
"Mon, Aug. 25, 2014",WhatsApp hits 600M MAUs; Facebook tops comScore app list
"Thu, Aug. 21, 2014","Facebook rolls out analytics tools for Instagram ads, App Links"
"Thu, Aug. 21, 2014","50 stocks that ""matter most"" to hedge funds"
"Sun, Aug. 10, 2014",Facebook sees backlash over new Messenger app requirement
"Fri, Aug. 08, 2014",Report: Facebook talking with Hollywood about Oculus deals
"Tue, Jul. 29, 2014","Facebook, LinkedIn, Yelp, GSV rise AH thanks to Twitter"
"Thu, Jul. 24, 2014",Facebook makes new highs; Q2 ad performance well-received
"Wed, Jul. 23, 2014","Facebook now +5.3% AH; ad prices soar, impressions drop"
"Wed, Jul. 23, 2014",Mobile 62% of Facebook's ad sales; MAUs rise 14% Y/Y
"Wed, Jul. 23, 2014","Facebook beats by $0.10, beats on revenue"
"Mon, Jul. 21, 2014","Facebook unveils content-saving service, might use it for ad targeting"
"Fri, Jul. 18, 2014","Facebook tests Buy button, gives celebrities their own app"
"Tue, Jul. 08, 2014","Facebook ad partner reports strong Q2 click rates, ad prices"
"Wed, Jul. 02, 2014",Facebook buying major video ad tech platform LiveRail
"Wed, Jul. 02, 2014","Facebook roundup: Foreign ads, mood experiment, App Links"
"Tue, Jun. 24, 2014","Oculus buys hardware R&D firm, looks for hardware partners"
"Tue, Jun. 24, 2014",Cantor upbeat on Facebook's video ads; Forrester teen survey positive
"Mon, Jun. 23, 2014",Facebook higher; Sterne forecasts $30B in 2018 revenue
"Tue, Jun. 17, 2014",Facebook launches would-be Snapchat rival
"Wed, Jun. 11, 2014",Instagram gives Facebook a Chinese opening
"Mon, Jun. 09, 2014",PayPal chief leaves to become Facebook's messaging chief
"Thu, Jun. 05, 2014",WhatsApp seeing challenges in U.S. and other markets
"Tue, Jun. 03, 2014",Facebook buys startup to strengthen push for carrier deals
"Fri, May 30, 2014",Facebook's Oculus reportedly teaming with Samsung for new headset
"Wed, May 28, 2014","Meeker's 2014 report touches on mobile growth, Google/Facebook ARPUs"
"Sat, May 24, 2014","Study: WhatsApp used by 41% of Indian Web users, 3% of U.S. users"
"Wed, May 21, 2014",ITG upbeat about Facebook's Q2; new music/TV service on tap
"Tue, May 20, 2014",Facebook bringing video ads to 7 more markets
"Mon, May 19, 2014",Facebook strikes ad deal with Publicis reportedly worth $500M
"Thu, May 15, 2014","FCC to decide on net neutrality, rules for spectrum auction"
"Tue, May 13, 2014","Study: Facebook and Twitter usage slips, with Instagram gaining"
"Mon, May 12, 2014","Bloomberg: Facebook ""taking steps"" to open Chinese office"
"Thu, May 08, 2014",Facebook gives advertisers more advanced audience data
"Thu, May 01, 2014",Yelp fuels Internet stock rally; LinkedIn on tap
"Wed, Apr. 30, 2014","Facebook launches mobile ad network, gives developers new tools"
"Fri, Apr. 25, 2014",Sharp losses for small caps and tech; money flows into utilities
"Thu, Apr. 24, 2014",Facebook turns negative; company acquiring fitness app
"Thu, Apr. 24, 2014",Facebook +5% premarket; but some are cautious
"Wed, Apr. 23, 2014",Facebook's CC: Messenger users top 200M; slower ad growth expected
"Wed, Apr. 23, 2014",Facebook CFO stepping down; shares now +2.4% AH
"Wed, Apr. 23, 2014","Facebook beats by $0.10, beats on revenue"
"Wed, Apr. 23, 2014",Google goes after Facebook's app ads; WhatsApp hits 500M MAUs
"Mon, Apr. 21, 2014",Facebook +1% AH on Credit Suisse upgrade
"Mon, Apr. 21, 2014",Report: Facebook mobile ad network launching at month's end
"Mon, Apr. 21, 2014",Gilead heads Citi's 20 best stocks in America
"Thu, Apr. 17, 2014",Twitter officially takes on Facebook's app install ads; shares gain
"Wed, Apr. 16, 2014","Zuck: Facebook unbundling apps, wants ""a pipeline of experiences"""
"Wed, Apr. 16, 2014",Facebook slips; ITG data points to subdued Q1 numbers
"Mon, Apr. 14, 2014","FT: Facebook looks to become ""e-money"" institution"
"Thu, Apr. 10, 2014",FTC clears Facebook/WhatsApp; deal price now at $17.6B
"Wed, Apr. 09, 2014",Facebook removing messaging from core apps
"Wed, Apr. 09, 2014",Facebook jumps on bullish notes; Sandberg refutes political speculation
"Tue, Apr. 08, 2014",WhatsApp launches prepaid service; Facebook's Indian users top 100M
"Fri, Apr. 04, 2014","Momentum stocks tumble, Nasdaq plunges 110"
"Tue, Apr. 01, 2014",Flurry: Google/Facebook account for 35% of U.S. mobile usage
"Tue, Apr. 01, 2014",Sandberg has sold more than half of Facebook stake
"Wed, Mar. 26, 2014",More on Facebook: Instagram's user base tops 200M
"Wed, Mar. 26, 2014",Google reportedly showed interest in Oculus; Zuck calls its tech superior
"Tue, Mar. 25, 2014",More on Facebook/Oculus
"Tue, Mar. 25, 2014",Facebook buying VR headset maker Oculus for up to $2.3B
"Wed, Mar. 19, 2014",eMarketer: Mobile ads growing 75% in 2014; Google/Facebook to dominate
"Thu, Mar. 13, 2014",Facebook finally launches news feed video ads
"Thu, Mar. 13, 2014",Facebook lower; OTR's checks point to moderating ad growth
"Tue, Mar. 11, 2014",Disney's ABC chief leaving; Facebook's Sandberg reportedly a CEO candidate
